smartctl 6.2 2013-07-26 r3841 [x86_64-linux-3.13.0-32-generic] (local build)
Copyright (C) 2002-13, Bruce Allen, Christian Franke, www.smartmontools.org

=== START OF READ SMART DATA SECTION ===
SMART Attributes Data Structure revision number: 1
Vendor Specific SMART Attributes with Thresholds:
ID# ATTRIBUTE_NAME          FLAG     VALUE WORST THRESH TYPE      UPDATED  WHEN_FAILED RAW_VALUE
  5 Reallocated_Sector_Ct   0x0033   100   100   010    Pre-fail  Always       -       0
  9 Power_On_Hours          0x0032   097   097   000    Old_age   Always       -       13206
 12 Power_Cycle_Count       0x0032   099   099   000    Old_age   Always       -       202
177 Wear_Leveling_Count     0x0013   082   082   000    Pre-fail  Always       -       1079
179 Used_Rsvd_Blk_Cnt_Tot   0x0013   100   100   010    Pre-fail  Always       -       0
181 Program_Fail_Cnt_Total  0x0032   100   100   010    Old_age   Always       -       0
182 Erase_Fail_Count_Total  0x0032   100   100   010    Old_age   Always       -       0
183 Runtime_Bad_Block       0x0013   100   100   010    Pre-fail  Always       -       0
187 Reported_Uncorrect      0x0032   100   100   000    Old_age   Always       -       0
190 Airflow_Temperature_Cel 0x0032   077   057   000    Old_age   Always       -       23
195 Hardware_ECC_Recovered  0x001a   200   200   000    Old_age   Always       -       0
199 UDMA_CRC_Error_Count    0x003e   100   100   000    Old_age   Always       -       0
235 Unknown_Attribute       0x0012   099   099   000    Old_age   Always       -       72
241 Total_LBAs_Written      0x0032   099   099   000    Old_age   Always       -       198946166769

